{
  "schema": "coursecraft.activities/1",
  "run_id": "cc:run:74ffddd8-382c-4365-aaf1-4ae1730fe3a2",
  "source": {
    "source_lineage_key": "cc:lineage:431334cbe13f558a2d72c27c9ee50df8",
    "source_instance_key": "cc:source:d08688cdb116c668b097ac3ef673567150a0001f8bf2b0128cb5f49298a20e36",
    "lineage_state": "unresolved",
    "lineage_basis": "logical_fingerprint",
    "lineage_candidates": [
      {
        "basis": "manifest_identifier",
        "value": "SAMPLE-ROBUST",
        "stability_class": "package_lineage_identifier"
      }
    ],
    "lineage_diagnostics": [
      "primary_identifiers_incomplete"
    ],
    "source_name": "sample_export.zip",
    "logical_fingerprint": {
      "algorithm": "sha256",
      "digest": "d08688cdb116c668b097ac3ef673567150a0001f8bf2b0128cb5f49298a20e36",
      "scope": "logical_file_set",
      "file_count": 30,
      "bytes": 21857,
      "extensions": {
        "skipped_symlink_count": 0
      }
    },
    "transport_fingerprint": {
      "algorithm": "sha256",
      "digest": "8d3f30d12ce71cd75551b40407b59ba52525cebdec61266ca67f852a39f0d64f",
      "scope": "transport_file",
      "bytes": 11538,
      "extensions": {}
    },
    "observed_identity": {
      "source_name": "sample_export.zip",
      "org_unit_id": null,
      "course_code": null,
      "export_timestamp": null,
      "orgunit_identifier": null,
      "orgunit_code": null,
      "orgunit_name": null,
      "manifest_identifier": "SAMPLE-ROBUST",
      "manifest_title": null,
      "manifest_course_code": null,
      "organization_title": null,
      "org_unit_id_basis": null
    },
    "extensions": {}
  },
  "export": "examples/sample_export.zip",
  "label": "sample_course",
  "export_identity": {
    "source_name": "sample_export.zip",
    "org_unit_id": null,
    "course_code": null,
    "export_timestamp": null,
    "orgunit_identifier": null,
    "orgunit_code": null,
    "orgunit_name": null
  },
  "condition_sets": [
    {
      "resource_code": "COND-OPEN",
      "tool": "",
      "operator": "",
      "conditions": [],
      "entity_key": "cc:entity:83fe0c27a130792e7878d180ff0af9bc",
      "identity": {
        "quality": "durable_source_id",
        "basis": "resource_code",
        "source_lineage_key": "cc:lineage:431334cbe13f558a2d72c27c9ee50df8",
        "source_aliases": [
          {
            "kind": "resource_code",
            "value": "COND-OPEN"
          }
        ],
        "extensions": {}
      }
    }
  ],
  "dropbox_folders": [
    {
      "id": "1",
      "name": "Planning Memo",
      "resource_code": "CODE-A1",
      "submission_type": "file",
      "folder_type": "",
      "out_of": "20",
      "grade_item_code": "CODE-G-A1",
      "rubric_ids": [
        "RUB-1"
      ],
      "date_due": "2026-09-20T03:59:59",
      "is_hidden": "",
      "condition_set": "COND-OPEN",
      "instructions_text": "Draft a short planning memo that names the evidence files you inspected. Use one paragraph for the manifest evidence. Use one paragraph for the activity join evidence.",
      "instructions_blocks": [
        {
          "kind": "p",
          "level": 0,
          "runs": [
            {
              "text": "Draft a short planning memo that names the evidence files you inspected.",
              "href": ""
            }
          ]
        },
        {
          "kind": "li",
          "level": 1,
          "runs": [
            {
              "text": "Use one paragraph for the manifest evidence.",
              "href": ""
            }
          ]
        },
        {
          "kind": "li",
          "level": 1,
          "runs": [
            {
              "text": "Use one paragraph for the activity join evidence.",
              "href": ""
            }
          ]
        }
      ],
      "instructions_html": "<p>Draft a short planning memo that names the evidence files you inspected.</p><ul><li>Use one paragraph for the manifest evidence.</li><li>Use one paragraph for the activity join evidence.</li></ul>",
      "images_missing_alt": 0,
      "grade_item_name": "Planning Memo",
      "grade_item_out_of": "20",
      "rubrics_resolved": "RUB-1: Planning Memo Rubric",
      "quicklink_count": 1,
      "entity_key": "cc:entity:175b5c35c9499f74dc4673fd99241171",
      "identity": {
        "quality": "durable_source_id",
        "basis": "resource_code",
        "source_lineage_key": "cc:lineage:431334cbe13f558a2d72c27c9ee50df8",
        "source_aliases": [
          {
            "kind": "resource_code",
            "value": "CODE-A1"
          },
          {
            "kind": "id",
            "value": "1"
          }
        ],
        "extensions": {}
      }
    },
    {
      "id": "2",
      "name": "Data Snapshot Worksheet",
      "resource_code": "CODE-A2",
      "submission_type": "file",
      "folder_type": "",
      "out_of": "10",
      "grade_item_code": "CODE-G-A2",
      "rubric_ids": [],
      "date_due": "",
      "is_hidden": "",
      "condition_set": "",
      "instructions_text": "Complete the worksheet using the course activities workbook generated by the bundle.",
      "instructions_blocks": [
        {
          "kind": "p",
          "level": 0,
          "runs": [
            {
              "text": "Complete the worksheet using the course activities workbook generated by the bundle.",
              "href": ""
            }
          ]
        }
      ],
      "instructions_html": "<p>Complete the worksheet using the course activities workbook generated by the bundle.</p>",
      "images_missing_alt": 0,
      "grade_item_name": "Data Snapshot Worksheet",
      "grade_item_out_of": "10",
      "rubrics_resolved": "",
      "quicklink_count": 1,
      "entity_key": "cc:entity:86df527955193c6252b14b6feeae382d",
      "identity": {
        "quality": "durable_source_id",
        "basis": "resource_code",
        "source_lineage_key": "cc:lineage:431334cbe13f558a2d72c27c9ee50df8",
        "source_aliases": [
          {
            "kind": "resource_code",
            "value": "CODE-A2"
          },
          {
            "kind": "id",
            "value": "2"
          }
        ],
        "extensions": {}
      }
    },
    {
      "id": "3",
      "name": "Reflection Journal",
      "resource_code": "CODE-A3",
      "submission_type": "text",
      "folder_type": "",
      "out_of": "5",
      "grade_item_code": "CODE-G-A3",
      "rubric_ids": [],
      "date_due": "",
      "is_hidden": "",
      "condition_set": "",
      "instructions_text": "Write a short reflection after reviewing Week 2 materials.",
      "instructions_blocks": [
        {
          "kind": "p",
          "level": 0,
          "runs": [
            {
              "text": "Write a short reflection after reviewing Week 2 materials.",
              "href": ""
            }
          ]
        }
      ],
      "instructions_html": "<p>Write a short reflection after reviewing Week 2 materials.</p>",
      "images_missing_alt": 0,
      "grade_item_name": "Reflection Journal",
      "grade_item_out_of": "5",
      "rubrics_resolved": "",
      "quicklink_count": 1,
      "entity_key": "cc:entity:18530ece207639a275670d69b224f643",
      "identity": {
        "quality": "durable_source_id",
        "basis": "resource_code",
        "source_lineage_key": "cc:lineage:431334cbe13f558a2d72c27c9ee50df8",
        "source_aliases": [
          {
            "kind": "resource_code",
            "value": "CODE-A3"
          },
          {
            "kind": "id",
            "value": "3"
          }
        ],
        "extensions": {}
      }
    },
    {
      "id": "4",
      "name": "Unplaced Capstone Draft",
      "resource_code": "CODE-AU",
      "submission_type": "file",
      "folder_type": "",
      "out_of": "15",
      "grade_item_code": "CODE-G-AU",
      "rubric_ids": [],
      "date_due": "",
      "is_hidden": "",
      "condition_set": "",
      "instructions_text": "This assignment is not linked in the manifest and should appear as unplaced.",
      "instructions_blocks": [
        {
          "kind": "p",
          "level": 0,
          "runs": [
            {
              "text": "This assignment is not linked in the manifest and should appear as unplaced.",
              "href": ""
            }
          ]
        }
      ],
      "instructions_html": "<p>This assignment is not linked in the manifest and should appear as unplaced.</p>",
      "images_missing_alt": 0,
      "grade_item_name": "Unplaced Capstone Draft",
      "grade_item_out_of": "15",
      "rubrics_resolved": "",
      "quicklink_count": 0,
      "entity_key": "cc:entity:f2280dc965bc820f041b2f46c3e49367",
      "identity": {
        "quality": "durable_source_id",
        "basis": "resource_code",
        "source_lineage_key": "cc:lineage:431334cbe13f558a2d72c27c9ee50df8",
        "source_aliases": [
          {
            "kind": "resource_code",
            "value": "CODE-AU"
          },
          {
            "kind": "id",
            "value": "4"
          }
        ],
        "extensions": {}
      }
    }
  ],
  "discussions": [
    {
      "kind": "forum",
      "source_file": "discussion_d2l_1.xml",
      "forum_id": "20",
      "topic_id": "",
      "title": "Course Discussions",
      "resource_code": "CODE-FORUM",
      "score_out_of": "",
      "grade_item_code": "",
      "rubric_ids": [],
      "is_hidden": "False",
      "requires_approval": "",
      "must_post_to_participate": "",
      "condition_set": "",
      "description_text": "",
      "description_html": "",
      "images_missing_alt": 0,
      "grade_item_name": "",
      "grade_item_out_of": "",
      "rubrics_resolved": "",
      "quicklink_count": 0,
      "entity_key": "cc:entity:1b1cdbdc99277a8c864e97ef4f3e2b05",
      "identity": {
        "quality": "durable_source_id",
        "basis": "resource_code",
        "source_lineage_key": "cc:lineage:431334cbe13f558a2d72c27c9ee50df8",